{
  "$schema": "http://json-schema.org/draft-07/schema#",
  "title": "Service Entry",
  "type": "object",
  "required": ["name", "url", "favicon_url", "category"],
  "properties": {
    "name": { "type": "string", "minLength": 1 },
    "url": { "type": "string", "minLength": 1 },
    "favicon_url": { "type": "string" },
    "category": { "type": "string", "minLength": 1 },
    "categories": {
      "type": "array",
      "items": { "type": "string" }
    },
    "tags": {
      "type": "array",
      "items": { "type": "string" }
    },
    "thumbnail_url": { "type": "string" }
  },
  "additionalProperties": false
}
