[
  {
    "name": "Alteryx AI Platform",
    "url": "https://www.alteryx.com/products/alteryx-ai-platform",
    "favicon_url": "https://www.alteryx.com/favicon.ico",
    "category": "\ud83e\udde0 Machine Learning Platforms",
    "tags": [
      "alteryx",
      "learning",
      "machine",
      "platforms"
    ]
  },
  {
    "name": "Amazon.com (Recommendation Engine)",
    "url": "https://www.amazon.com/",
    "favicon_url": "https://www.amazon.com/favicon.ico",
    "category": "\ud83d\uded2 E-commerce AI",
    "tags": [
      "amazon",
      "com",
      "commerce",
      "recommendation"
    ]
  },
  {
    "name": "Amazon Alexa",
    "url": "https://www.amazon.com/alexa",
    "favicon_url": "https://www.amazon.com/favicon.ico",
    "category": "\ud83c\udfa8 Conversational AI/Smart Home AI",
    "tags": [
      "alexa",
      "amazon",
      "conversational",
      "home",
      "smart"
    ]
  },
  {
    "name": "Amazon CodeCatalyst (AI features)",
    "url": "https://aws.amazon.com/codecatalyst/",
    "favicon_url": "https://aws.amazon.com/favicon.ico",
    "category": "\ud83d\udcbb Developer AI",
    "tags": [
      "amazon",
      "codecatalyst",
      "developer"
    ]
  },
  {
    "name": "Amazon CodeWhisperer",
    "url": "https://aws.amazon.com/codewhisperer/",
    "favicon_url": "https://aws.amazon.com/favicon.ico",
    "category": "\u2728 Generative AI",
    "tags": [
      "amazon",
      "codewhisperer",
      "generative"
    ]
  },
  {
    "name": "Amazon DeepComposer",
    "url": "https://aws.amazon.com/deepcomposer/",
    "favicon_url": "https://aws.amazon.com/favicon.ico",
    "category": "\ud83d\udd0a Generative Music AI",
    "tags": [
      "amazon",
      "deepcomposer",
      "generative",
      "music"
    ]
  },
  {
    "name": "Amazon DeepRacer",
    "url": "https://aws.amazon.com/deepracer/",
    "favicon_url": "https://aws.amazon.com/favicon.ico",
    "category": "\u2728 Reinforcement Learning AI",
    "tags": [
      "amazon",
      "deepracer",
      "learning",
      "reinforcement"
    ]
  },
  {
    "name": "Amazon Fraud Detector",
    "url": "https://aws.amazon.com/fraud-detector/",
    "favicon_url": "https://aws.amazon.com/favicon.ico",
    "category": "\ud83d\udcb0 Fraud Prevention AI",
    "tags": [
      "amazon",
      "detector",
      "fraud",
      "prevention"
    ]
  },
  {
    "name": "Amazon Go Stores (Just Walk Out Technology)",
    "url": "https://www.amazon.com/b?node=16008589011",
    "favicon_url": "https://www.amazon.com/favicon.ico",
    "category": "\ud83d\uded2 Retail",
    "tags": [
      "amazon",
      "just",
      "out",
      "retail",
      "stores",
      "technology",
      "walk"
    ]
  },
  {
    "name": "Amazon Kinesis Video Streams with Rekognition Video",
    "url": "https://aws.amazon.com/kinesis/video-streams/integrations/rekognition-video/",
    "favicon_url": "https://aws.amazon.com/favicon.ico",
    "category": "\ud83c\udfac Video Generation and Editing",
    "tags": [
      "amazon",
      "analytics",
      "kinesis",
      "rekognition",
      "streams",
      "video"
    ]
  },
  {
    "name": "Amazon Prime Video / Music (AI for recommendations)",
    "url": "https://www.amazon.com/primevideo",
    "favicon_url": "https://www.amazon.com/favicon.ico",
    "category": "\u2728 Recommendation AI",
    "tags": [
      "amazon",
      "music",
      "prime",
      "recommendation",
      "recommendations",
      "video"
    ]
  },
  {
    "name": "Amazon Rekognition",
    "url": "https://aws.amazon.com/rekognition/",
    "favicon_url": "https://aws.amazon.com/favicon.ico",
    "category": "\ud83d\udc41\ufe0f Computer Vision",
    "tags": [
      "amazon",
      "computer",
      "rekognition",
      "vision"
    ]
  },
  {
    "name": "Amazon Robotics",
    "url": "https://www.amazonrobotics.com/",
    "favicon_url": "https://www.amazonrobotics.com/favicon.ico",
    "category": "\ud83e\udd16 Robotics/Warehouse AI",
    "tags": [
      "amazon",
      "robotics",
      "warehouse"
    ]
  },
  {
    "name": "Amazon Supply Chain",
    "url": "https://aws.amazon.com/aws-supply-chain/",
    "favicon_url": "https://aws.amazon.com/favicon.ico",
    "category": "\ud83d\udcca Supply Chain AI",
    "tags": [
      "amazon",
      "chain",
      "supply"
    ]
  },
  {
    "name": "Amplitude (AI features)",
    "url": "https://amplitude.com/solutions/ai-for-product",
    "favicon_url": "https://amplitude.com/favicon.ico",
    "category": "\ud83d\udd0d Product Analytics AI",
    "tags": [
      "amplitude",
      "analytics",
      "product"
    ]
  },
  {
    "name": "Amplify (Manufacturing Execution System with AI)",
    "url": "https://www.amplify.ai/",
    "favicon_url": "https://www.amplify.ai/favicon.ico",
    "category": "\ud83c\udfed Manufacturing AI",
    "tags": [
      "amplify",
      "execution",
      "manufacturing"
    ]
  },
  {
    "name": "Apple Health (AI for health insights)",
    "url": "https://www.apple.com/ios/health/",
    "favicon_url": "https://www.apple.com/favicon.ico",
    "category": "\ud83e\ude7a Health AI",
    "tags": [
      "apple",
      "health",
      "insights"
    ]
  },
  {
    "name": "Apple Keyboard (Predictive Text, Autocorrect)",
    "url": "(Integrated into iOS/macOS)",
    "favicon_url": "./favicon.ico",
    "category": "\ud83d\udde3\ufe0f NLP/Productivity AI",
    "tags": [
      "apple",
      "autocorrect",
      "keyboard",
      "nlp",
      "predictive",
      "productivity",
      "text"
    ]
  },
  {
    "name": "Apple Maps (AI for navigation, Look Around)",
    "url": "https://www.apple.com/ios/maps/",
    "favicon_url": "https://www.apple.com/favicon.ico",
    "category": "\ud83e\udded Geospatial/Navigation AI",
    "tags": [
      "apple",
      "around",
      "geospatial",
      "look",
      "maps",
      "navigation"
    ]
  },
  {
    "name": "Apple Music (AI for recommendations)",
    "url": "https://www.apple.com/apple-music/",
    "favicon_url": "https://www.apple.com/favicon.ico",
    "category": "\u2728 Recommendation AI",
    "tags": [
      "apple",
      "music",
      "recommendation",
      "recommendations"
    ]
  },
  {
    "name": "Apple Photos (AI for recognition, search)",
    "url": "https://www.apple.com/ios/photos/",
    "favicon_url": "https://www.apple.com/favicon.ico",
    "category": "\ud83c\udfa8 Image Generation and Design",
    "tags": [
      "apple",
      "image",
      "media",
      "photos",
      "recognition",
      "search"
    ]
  },
  {
    "name": "Asana (AI features)",
    "url": "https://asana.com/",
    "favicon_url": "https://asana.com/favicon.ico",
    "category": "\ud83d\udcdd Productivity AI",
    "tags": [
      "asana",
      "productivity"
    ]
  },
  {
    "name": "Audio.com (by Epidemic Sound)",
    "url": "https://www.audio.com/",
    "favicon_url": "https://www.audio.com/favicon.ico",
    "category": "\ud83d\udd0a Music AI",
    "tags": [
      "audio",
      "com",
      "epidemic",
      "music",
      "sound"
    ]
  },
  {
    "name": "BenchSci",
    "url": "https://www.benchsci.com/",
    "favicon_url": "https://www.benchsci.com/favicon.ico",
    "category": "\ud83e\ude7a Life Sciences AI",
    "tags": [
      "benchsci",
      "life",
      "sciences"
    ]
  },
  {
    "name": "Bright Machines",
    "url": "https://www.brightmachines.com/",
    "favicon_url": "https://www.brightmachines.com/favicon.ico",
    "category": "\ud83e\udd16 Factory Automation AI",
    "tags": [
      "bright",
      "factory",
      "machines"
    ]
  },
  {
    "name": "Canva (Magic Studio AI)",
    "url": "https://www.canva.com/magic-studio/",
    "favicon_url": "https://www.canva.com/favicon.ico",
    "category": "\ud83c\udfa8 Design AI",
    "tags": [
      "canva",
      "design",
      "magic"
    ]
  },
  {
    "name": "Carbon Chain",
    "url": "https://carbonchain.com/",
    "favicon_url": "https://carbonchain.com/favicon.ico",
    "category": "\ud83d\udcca Supply Chain AI",
    "tags": [
      "carbon",
      "chain",
      "supply"
    ]
  },
  {
    "name": "Casetext (CoCounsel)",
    "url": "https://casetext.com/",
    "favicon_url": "https://casetext.com/favicon.ico",
    "category": "\ud83d\udcbc Legal AI",
    "tags": [
      "casetext",
      "cocounsel",
      "legal"
    ]
  },
  {
    "name": "Character.ai",
    "url": "[suspicious link removed]",
    "favicon_url": "./favicon.ico",
    "category": "\u2728 Large Language Models",
    "tags": [
      "character",
      "language",
      "large",
      "models"
    ]
  },
  {
    "name": "ChowNow (OrderBetter AI)",
    "url": "https://orderbetter.ai/",
    "favicon_url": "https://orderbetter.ai/favicon.ico",
    "category": "\ud83c\udf72 Food Service AI",
    "tags": [
      "chownow",
      "food",
      "orderbetter"
    ]
  },
  {
    "name": "Civitas (AI for Government)",
    "url": "https://www.civitas.ai/",
    "favicon_url": "https://www.civitas.ai/favicon.ico",
    "category": "\u2728 Public Sector AI",
    "tags": [
      "civitas",
      "government",
      "public",
      "sector"
    ]
  },
  {
    "name": "Cognex (VisionPro Deep Learning)",
    "url": "https://www.cognex.com/products/deep-learning",
    "favicon_url": "https://www.cognex.com/favicon.ico",
    "category": "\ud83c\udfed Industrial AI",
    "tags": [
      "cognex",
      "deep",
      "industrial",
      "learning",
      "visionpro"
    ]
  },
  {
    "name": "Collibra (AI Governance)",
    "url": "https://www.collibra.com/solutions/ai-governance",
    "favicon_url": "https://www.collibra.com/favicon.ico",
    "category": "\u2728 Data Governance AI",
    "tags": [
      "collibra",
      "governance"
    ]
  },
  {
    "name": "Core ML (Apple)",
    "url": "https://developer.apple.com/documentation/coreml/",
    "favicon_url": "https://developer.apple.com/favicon.ico",
    "category": "\u2728 On-device ML",
    "tags": [
      "apple",
      "core",
      "device",
      "ml"
    ]
  },
  {